{
  "schema_version": "northstar.rust-quality.detector-candidates.v1",
  "language": "rust",
  "qualified_on": "2026-08-26",
  "toolchains": ["Rust 1.95.0", "Rust 1.97.1"],
  "candidates": [
    {
      "id": "public-debug",
      "concern": "Public type lacks Debug",
      "diagnostics": ["missing_debug_implementations"],
      "decidability": "partially_decidable",
      "false_positive_class": "repository_policy",
      "disposition": "promote_evidence",
      "target_rules": ["RUST-API-001"],
      "detector_authority": "none",
      "provenance": [{"authority": "rustc", "revision": "stable docs and Rust 1.95/1.97", "url": "https://doc.rust-lang.org/stable/rustc/lints/listing/allowed-by-default.html#missing-debug-implementations"}],
      "applicability": "Public types in library or public crate API surfaces; redaction and justified omission remain manual.",
      "evidence": {
        "invalid_fixture": "invalid fixture emits the exact diagnostic on both toolchains",
        "valid_fixture": "derived Debug produces no candidate diagnostic",
        "exception_fixture": "protected fields and compile-size policy cannot be decided by the lint",
        "repair": "revision M public-type repair used the existing RUST-API-001 authority",
        "preservation": "revision M preserved clean controls and public behavior",
        "churn": "revision M passed its exact changed-scope gate",
        "blind_review": "revision M blind reviewers accepted all repairs; the lint itself grants no repair"
      },
      "rationale": "The diagnostic precisely identifies missing Debug, but cannot choose derive, redacted manual output, or an accepted omission."
    },
    {
      "id": "unsafe-structure",
      "concern": "Unsafe operations or contracts lack explicit structural evidence",
      "diagnostics": ["E0133", "clippy::missing_safety_doc", "clippy::undocumented_unsafe_blocks"],
      "decidability": "partially_decidable",
      "false_positive_class": "repository_policy",
      "disposition": "promote_enforcement",
      "target_rules": ["RUST-UNSAFE-001"],
      "detector_authority": "none",
      "provenance": [
        {"authority": "rustc", "revision": "stable docs and Rust 1.95/1.97", "url": "https://doc.rust-lang.org/stable/rustc/lints/listing/allowed-by-default.html#unsafe-op-in-unsafe-fn"},
        {"authority": "Clippy", "revision": "stable docs and Rust 1.95/1.97", "url": "https://rust-lang.github.io/rust-clippy/stable/index.html#missing_safety_doc"}
      ],
      "applicability": "Unsafe blocks, functions, traits, implementations, raw pointers, and FFI; content and soundness remain manual.",
      "evidence": {
        "invalid_fixture": "invalid fixture emits all three normalized identifiers",
        "valid_fixture": "explicit unsafe block, Safety docs, and concrete comment emit none",
        "exception_fixture": "E0133 is an error code rather than the lint name; manual source context remains required",
        "repair": "strict repair remains report-only; no detector-authored repair was run",
        "preservation": "revisions J-M preserved unsafe fixtures byte-for-byte",
        "churn": "zero unsafe-boundary churn was required by the strict evidence gate",
        "blind_review": "revision M reviewers accepted the report-only unsafe disposition"
      },
      "rationale": "The checks enforce visible structure. They cannot prove that the documented invariants discharge the exact unsafe operation contract."
    },
    {
      "id": "await-held-guards",
      "concern": "A lock guard or RefCell borrow crosses an await point",
      "diagnostics": ["clippy::await_holding_lock", "clippy::await_holding_refcell_ref"],
      "decidability": "partially_decidable",
      "false_positive_class": "documented_upstream",
      "disposition": "promote_enforcement",
      "target_rules": ["RUST-ASYNC-001"],
      "detector_authority": "none",
      "provenance": [{"authority": "Clippy", "revision": "stable docs and Rust 1.95/1.97", "url": "https://rust-lang.github.io/rust-clippy/stable/index.html#await_holding_lock"}],
      "applicability": "std/parking_lot lock guards and RefCell borrows live across await; cancellation and state consistency remain manual.",
      "evidence": {
        "invalid_fixture": "both guard diagnostics fire on both toolchains",
        "valid_fixture": "lexical scope before await emits neither diagnostic",
        "exception_fixture": "Clippy documents explicit-drop false positives",
        "repair": "revision M repaired the blocking-lock case under RUST-ASYNC-001",
        "preservation": "revision M preserved behavior and clean controls",
        "churn": "revision M passed exact scope and churn gates",
        "blind_review": "revision M reviewers accepted the lock-scope repair"
      },
      "rationale": "The live guard is a strong actionable signal, but changing lock type or state transitions still requires source review."
    },
    {
      "id": "msrv-item-use",
      "concern": "A standard-library item is newer than the configured MSRV",
      "diagnostics": ["clippy::incompatible_msrv"],
      "decidability": "partially_decidable",
      "false_positive_class": "configuration",
      "disposition": "promote_evidence",
      "target_rules": ["RUST-MSRV-001"],
      "detector_authority": "none",
      "provenance": [
        {"authority": "Cargo", "revision": "stable docs 2026-08-26", "url": "https://doc.rust-lang.org/cargo/reference/rust-version.html"},
        {"authority": "Clippy", "revision": "stable docs and Rust 1.95/1.97", "url": "https://rust-lang.github.io/rust-clippy/stable/index.html#incompatible_msrv"}
      ],
      "applicability": "Packages with resolved rust-version or equivalent Clippy MSRV configuration.",
      "evidence": {
        "invalid_fixture": "OnceLock against rust-version 1.60 emits the diagnostic on both toolchains",
        "valid_fixture": "Once against the same MSRV emits no diagnostic",
        "exception_fixture": "feature-local MSRV overrides and dependencies require repository policy",
        "repair": "detector proposes no version-policy change; equivalent replacement uses existing rule authority",
        "preservation": "minimum-toolchain validation remains mandatory after any replacement",
        "churn": "only the incompatible item may enter repair scope",
        "blind_review": "no new repair class was promoted; version-policy changes remain operator decisions"
      },
      "rationale": "The lint is precise for known library stabilization data but does not replace an actual minimum-toolchain build or cover every dependency and language feature."
    },
    {
      "id": "broken-public-doc-links",
      "concern": "Published documentation contains an unresolved intra-doc link",
      "diagnostics": ["rustdoc::broken_intra_doc_links", "rustdoc::private_intra_doc_links"],
      "decidability": "decidable",
      "false_positive_class": "none_observed",
      "disposition": "promote_evidence",
      "target_rules": ["RUST-API-001"],
      "detector_authority": "none",
      "provenance": [{"authority": "rustdoc", "revision": "stable docs and Rust 1.95/1.97", "url": "https://doc.rust-lang.org/rustdoc/lints.html#broken_intra_doc_links"}],
      "applicability": "Public documentation built with the repository's normal rustdoc configuration.",
      "evidence": {
        "invalid_fixture": "broken link emits the exact rustdoc diagnostic on both toolchains",
        "valid_fixture": "link to a public type emits no diagnostic",
        "exception_fixture": "document-private-items changes private-link behavior and must be recorded",
        "repair": "evidence-only; no new automatic or detector-owned repair",
        "preservation": "a repair must preserve the intended API target and documentation meaning",
        "churn": "only the broken link and required rename context may change",
        "blind_review": "no normative rule or repair authority was added, so a new blind repair cohort was not claimed"
      },
      "rationale": "Resolution is mechanical under a fixed rustdoc configuration; the intended replacement target is still a human API decision."
    },
    {
      "id": "public-failure-documentation",
      "concern": "Public Result or panic behavior lacks Errors or Panics documentation",
      "diagnostics": ["clippy::missing_errors_doc", "clippy::missing_panics_doc"],
      "decidability": "partially_decidable",
      "false_positive_class": "repository_policy",
      "disposition": "evaluation_only",
      "target_rules": ["RUST-ERR-001"],
      "detector_authority": "none",
      "provenance": [{"authority": "Clippy", "revision": "stable docs and Rust 1.95/1.97", "url": "https://rust-lang.github.io/rust-clippy/stable/index.html#missing_errors_doc"}],
      "applicability": "Public functions in documented API surfaces; generated, private, and intentionally opaque APIs need policy.",
      "evidence": {
        "invalid_fixture": "both diagnostics fire on the invalid public API fixture",
        "valid_fixture": "complete Errors and Panics sections emit neither diagnostic",
        "exception_fixture": "panic detection is incomplete and local expect/allow annotations may encode proven invariants",
        "repair": "no independent documentation-repair cohort exists",
        "preservation": "error contracts must be traced before documentation changes",
        "churn": "not measured independently",
        "blind_review": "not independently reviewed"
      },
      "rationale": "Useful evidence, but incomplete panic discovery and absent repair review block normative promotion."
    },
    {
      "id": "panic-capable-operations",
      "concern": "Production code uses unwrap, expect, panic, or unchecked indexing",
      "diagnostics": ["clippy::unwrap_used", "clippy::expect_used", "clippy::panic", "clippy::indexing_slicing"],
      "decidability": "meaning_dependent",
      "false_positive_class": "semantic",